{
  "$schema": "../../../schemas/rulepack.schema.json",
  "id": "project-docs/java",
  "version": "0.1.5",
  "status": "ready",
  "kind": "documentation",
  "entry": "其他规则/04-JavaAI技术文档任务入口.md",
  "dependencies": [
    "common"
  ],
  "rules": [
    "其他规则/00-Java技术文档编写规范总览.md",
    "其他规则/01-技术文档组织与维护规范.md",
    "其他规则/02-Java技术文档编写规范.md",
    "其他规则/03-Java技术文档模板.md",
    "其他规则/04-JavaAI技术文档任务入口.md"
  ]
}
