{
  "$schema": "../../schemas/rulepack.schema.json",
  "id": "unity",
  "version": "0.1.5",
  "status": "ready",
  "kind": "development",
  "entry": "15-AI通用入口规则.md",
  "dependencies": [
    "common"
  ],
  "rules": [
    "00-文档总览.md",
    "15-AI通用入口规则.md",
    "其他规则/01-代码编写规则.md",
    "其他规则/02-模式设计规则.md",
    "其他规则/03-性能优化规则.md",
    "其他规则/04-UGUI设计规则.md",
    "其他规则/05-UI Toolkit设计规则.md",
    "其他规则/06-项目配置规则.md",
    "其他规则/07-日志调试规则.md",
    "其他规则/08-版本控制规则.md",
    "其他规则/09-资源管理规则.md",
    "其他规则/10-代码风格规则.md",
    "其他规则/11-扩展编辑器规则.md",
    "其他规则/12-网络模块规则.md",
    "其他规则/13-服务端模块规则.md",
    "其他规则/14-安全模块规则.md",
    "其他规则/16-问题定位与根因确认规则.md"
  ]
}
