{
  "$schema": "../../schemas/rulepack.schema.json",
  "id": "typescript",
  "version": "0.1.5",
  "status": "ready",
  "kind": "development",
  "entry": "09-AI通用入口规则.md",
  "dependencies": [
    "common",
    "javascript"
  ],
  "rules": [
    "00-文档总览.md",
    "09-AI通用入口规则.md",
    "其他规则/01-类型系统.md",
    "其他规则/02-类型守卫与收窄.md",
    "其他规则/03-TS 独有与 JS 差异.md",
    "其他规则/04-高级类型.md",
    "其他规则/05-声明文件.md",
    "其他规则/06-tsconfig 严格度.md",
    "其他规则/07-ESLint + Prettier TS 集成.md",
    "其他规则/08-常见反模式与 AI 自检.md"
  ]
}
