{
  "$schema": "../../schemas/rulepack.schema.json",
  "id": "go",
  "version": "0.1.5",
  "status": "ready",
  "kind": "development",
  "entry": "13-AI通用入口规则.md",
  "dependencies": [
    "common"
  ],
  "rules": [
    "00-文档总览.md",
    "13-AI通用入口规则.md",
    "其他规则/01-代码编写规则.md",
    "其他规则/02-模式设计.md",
    "其他规则/03-性能优化.md",
    "其他规则/04-API设计规则.md",
    "其他规则/05-数据库与持久化.md",
    "其他规则/06-项目配置规则.md",
    "其他规则/07-日志调试规则.md",
    "其他规则/08-版本控制规则.md",
    "其他规则/09-依赖与构建.md",
    "其他规则/10-代码风格规则.md",
    "其他规则/11-测试与可观测性.md",
    "其他规则/12-安全规则.md"
  ]
}
