{
  "$schema": "../../schemas/rulepack.schema.json",
  "id": "javascript",
  "version": "0.1.5",
  "status": "ready",
  "kind": "development",
  "entry": "15-AI通用入口规则.md",
  "dependencies": [
    "common"
  ],
  "rules": [
    "00-文档总览.md",
    "15-AI通用入口规则.md",
    "其他规则/01-代码编写规则.md",
    "其他规则/02-模式设计规则.md",
    "其他规则/03-性能优化规则.md",
    "其他规则/04-异步与事件循环.md",
    "其他规则/05-数据访问规则.md",
    "其他规则/06-项目配置规则.md",
    "其他规则/07-日志调试规则.md",
    "其他规则/08-测试规则.md",
    "其他规则/09-版本控制规则.md",
    "其他规则/10-代码风格规则.md",
    "其他规则/11-安全规则.md",
    "其他规则/12-JS常见反模式.md",
    "其他规则/13-React组件规则.md",
    "其他规则/14-CSS与样式体系规则.md",
    "其他规则/16-Vue组件规则.md"
  ]
}
