{
  "$schema": "../../schemas/rulepack.schema.json",
  "id": "java",
  "version": "0.1.5",
  "status": "ready",
  "kind": "development",
  "entry": "14-AI通用入口规则.md",
  "dependencies": [
    "common"
  ],
  "rules": [
    "00-文档总览.md",
    "14-AI通用入口规则.md",
    "其他规则/01-代码编写规则.md",
    "其他规则/02-代码风格规则.md",
    "其他规则/03-异常处理规则.md",
    "其他规则/04-并发编程规则.md",
    "其他规则/05-模式设计规则.md",
    "其他规则/06-Web-API设计规则.md",
    "其他规则/07-数据访问规则.md",
    "其他规则/08-测试规则.md",
    "其他规则/09-日志调试规则.md",
    "其他规则/10-版本控制规则.md",
    "其他规则/11-性能优化规则.md",
    "其他规则/12-安全规则.md",
    "其他规则/13-部署运维规则.md"
  ]
}
